{
  "schema": "gtosd.gto_plus_convergence_benchmark.v1",
  "benchmark_id": "GTP-AHKHQH-003",
  "source": "GTO+",
  "fixture": {
    "variant": "short_deck_hu_postflop",
    "deck": "36_cards_6_to_ace",
    "flop": ["Ah", "Kh", "Qh"],
    "range_co": "AA-QQ,AKs-AQs,KQs,AKo-AQo,KQo",
    "range_btn": "AA-QQ,AKs-AQs,KQs,AKo-AQo,KQo",
    "physical_combos_after_blockers_per_player": 36,
    "initial_pot_antes": 40,
    "effective_stack_antes": 100,
    "bet_size_percent_pot": 50,
    "raise_size_percent_pot": 50,
    "maximum_raises_per_street": 1,
    "raises": "half_pot",
    "automatic_all_in": "go_if_remaining_stack_below_150_percent_current_pot",
    "automatic_all_in_strict_boundary": true,
    "final_bet_smoothing": "disabled",
    "rake_percent": 0
  },
  "gto_plus_reference": {
    "elapsed_seconds": 1.71,
    "solver_memory_bytes": 8000000,
    "target_dev_percent": 1.0,
    "target_definition": "maximum unilateral best-response gain divided by the initial pot",
    "target_provenance": "time, solver RAM, node EV references and disabled final-bet smoothing confirmed by the user; legal action and frequency references transcribed from the prepared GTO+ v1.6.9 solution",
    "timing_scope": "from Run Solver on a prepared tree until the complete solution was viewable",
    "hardware_relation": "same machine as GTOSD benchmark",
    "metadata_complete": false,
    "flop_ev_antes": {
      "display_convention": "conditional player EV at the public node including the player's initial-pot contribution",
      "absolute_tolerance_antes": 0.05,
      "co_root": 19.15,
      "btn_after_co_check": 21.65,
      "btn_after_co_bet_20": 17.51
    },
    "flop_action_frequencies": {
      "absolute_tolerance_fraction": 0.01,
      "display_precision_percent": 0.1,
      "flop_co_root": {
        "check": 0.803,
        "bet_20": 0.197
      },
      "flop_btn_after_co_bet_20": {
        "fold": 0.374,
        "call_20": 0.626,
        "raise_60": 0.0
      }
    }
  },
  "gtosd_run": {
    "maximum_iterations": 200,
    "certification_interval": 20,
    "averaging_delay": 20,
    "parallel_action_depth": 5,
    "maximum_solver_threads": 6,
    "independent_processes": 5,
    "timer_scope": "from Run Solver on the prepared tree through initialization, CFR+ traversals, averaging and final exact BR certification"
  },
  "expected_layout": {
    "game_fingerprint": "fnv1a64:001a19fa48cd8b1e",
    "physical_public_nodes": 112848,
    "canonical_public_nodes": 31461,
    "information_sets": 250704,
    "actions": 526872,
    "solver_state_bytes": 4214976
  }
}
